### ISSUE TITLE
Proxy: Accepts work from Block Erupter Cubes but doesn't return result to them

### ISSUE THREAD

**Issue by silverthornne** [luke-jr/bfgminer#462]
I've noticed some odd behaviour from bfgminer's proxy to Block Erupter cubes ever since updating to bfg 4.0. The Cubes submit their work and bfgminer reports the results of their work, but the Block Erupter Cube admin page never reports whether a share has been accepted or not; it just stays at 0 shares accepted.

The device also automatically switches pools to the secondary pool and back to the main pool constantly, I believe because it never receives any feedback about the work it submits it just assumes the pool is dead and moves to the other one and this has a negative impact on hashing rate.

**Comment by luke-jr** [comment]
Ugh, this is no doubt a cube bug, but I guess we need to workaround it. :(

**Comment by nwoolls** [comment]
Blade v2 as well. I can physically confirm both.

**Comment by luke-jr** [comment]
Unfortunately, my cubes are working fine with 4.0. Additionally, the related code has not really changed since 3.10.0 for SHA2... :/

**Comment by silverthornne** [comment]
Hmm.. that happens with the 32.bit bfg using this switch: --http-port 8330

Maybe we need to modify the switch? Use the 64-bit? I'll download 64-bit and see how that works out.

**Comment by luke-jr** [comment]
I only have 32-bit Linux. Maybe this is a Windows-specific issue...

libmicrohttpd did get upgraded - can you try 4.0 with the libmicrohttp DLL from 3.10.0 (32-bit only)?

**Comment by silverthornne** [comment]
Well, I didn't need to try that. The Cube is working fine with the 64-bit bfg so yes, that fixes it for me but it makes me wonder why that would happen like that.

**Comment by luke-jr** [comment]
Please do try that.

**Comment by silverthornne** [comment]
So I copied the libmicrohttp.dll from 3.10 to 4.0 and then it requested libplibc-1.dll and then I copied that and then it didn't work. I'll try to reboot it and then run it with the dll's from 3.10 and see what happens.

**Comment by luke-jr** [comment]
Hrm, guess it'd need to be built against the older version :/

How about a packet capture of both broken and working?

**Comment by silverthornne** [comment]
I can do that much later today; I'm actually at work and shouldn't be remoting to my home PC so often. Anyway, will post when I grab that.

**Comment by silverthornne** [comment]
I'm using WireShark to capture the packets, but I'm not sure what I'm supposed to be looking for. Anyway, next two posts with info.

**Comment by silverthornne** [comment]
216 is the cube, 201 is the PC running bdf miner.
Working (bfgminer 3.10):

No.     Time           Source                Destination           Protocol Length Info
      1 0.000000000    192.168.0.216         192.168.0.201         HTTP     361    POST / HTTP/1.1  (application/json)

Frame 1: 361 bytes on wire (2888 bits), 361 bytes captured (2888 bits) on interface 0
Ethernet II, Src: Microchi_xx:xx:xx (MAC address), Dst: AsustekC_xx:xx:xx:xx (MAC address)
Internet Protocol Version 4, Src: 192.168.0.216 (192.168.0.216), Dst: 192.168.0.201 (192.168.0.201)
Transmission Control Protocol, Src Port: aviva-sna (2238), Dst Port: 8330 (8330), Seq: 1, Ack: 1, Len: 307
Hypertext Transfer Protocol
JavaScript Object Notation: application/json

No.     Time           Source                Destination           Protocol Length Info
      2 0.000291000    192.168.0.201         192.168.0.216         TCP      264    [TCP segment of a reassembled PDU]

Frame 2: 264 bytes on wire (2112 bits), 264 bytes captured (2112 bits) on interface 0
Ethernet II, Src: AsustekC_xx:xx:xx (MAC address), Dst: Microchi_xx:xx:xx MAC address)
Internet Protocol Version 4, Src: 192.168.0.201 (192.168.0.201), Dst: 192.168.0.216 (192.168.0.216)
Transmission Control Protocol, Src Port: 8330 (8330), Dst Port: aviva-sna (2238), Seq: 1, Ack: 308, Len: 210

No.     Time           Source                Destination           Protocol Length Info
      3 0.000423000    192.168.0.201         192.168.0.216         HTTP     645    HTTP/1.1 200 OK  (application/json)

Frame 3: 645 bytes on wire (5160 bits), 645 bytes captured (5160 bits) on interface 0
Ethernet II, Src: AsustekC_xx:xx:xx (MAC address), Dst: Microchi_xx:xx:xx (MAC address)
Internet Protocol Version 4, Src: 192.168.0.201 (192.168.0.201), Dst: 192.168.0.216 (192.168.0.216)
Transmission Control Protocol, Src Port: 8330 (8330), Dst Port: aviva-sna (2238), Seq: 211, Ack: 308, Len: 591
[2 Reassembled TCP Segments (801 bytes): #2(210), #3(591)]
Hypertext Transfer Protocol
JavaScript Object Notation: application/json

No.     Time           Source                Destination           Protocol Length Info
      4 0.013683000    192.168.0.216         192.168.0.201         TCP      60     aviva-sna > 8330 [ACK] Seq=308 Ack=802 Win=99 Len=0

Frame 4: 60 bytes on wire (480 bits), 60 bytes captured (480 bits) on interface 0
Ethernet II, Src: Microchi_xx:xx:xx (MAC address), Dst: AsustekC_xx:xx:xx (MAC address)
Internet Protocol Version 4, Src: 192.168.0.216 (192.168.0.216), Dst: 192.168.0.201 (192.168.0.201)
Transmission Control Protocol, Src Port: aviva-sna (2238), Dst Port: 8330 (8330), Seq: 308, Ack: 802, Len: 0

No.     Time           Source                Destination           Protocol Length Info
      5 0.020002000    192.168.0.216         192.168.0.201         HTTP     361    POST / HTTP/1.1  (application/json)

Frame 5: 361 bytes on wire (2888 bits), 361 bytes captured (2888 bits) on interface 0
Ethernet II, Src: Microchi_xx:xx:xx (MAC address), Dst: AsustekC_xx:xx:x (MAC address)
Internet Protocol Version 4, Src: 192.168.0.216 (192.168.0.216), Dst: 192.168.0.201 (192.168.0.201)
Transmission Control Protocol, Src Port: imagequery (2239), Dst Port: 8330 (8330), Seq: 1, Ack: 1, Len: 307
Hypertext Transfer Protocol
JavaScript Object Notation: application/json

No.     Time           Source                Destination           Protocol Length Info
      6 0.020236000    192.168.0.201         192.168.0.216         TCP      264    [TCP segment of a reassembled PDU]

Frame 6: 264 bytes on wire (2112 bits), 264 bytes captured (2112 bits) on interface 0
Ethernet II, Src: AsustekC_xx:xx:xx (MAC address), Dst: Microchi_xx:x:x (MAC address)
Internet Protocol Version 4, Src: 192.168.0.201 (192.168.0.201), Dst: 192.168.0.216 (192.168.0.216)
Transmission Control Protocol, Src Port: 8330 (8330), Dst Port: imagequery (2239), Seq: 1, Ack: 308, Len: 210

**Comment by silverthornne** [comment]
Broken:

No.     Time           Source                Destination           Protocol Length Info
      1 0.000000000    192.168.0.216         192.168.0.201         TCP      60     oracle-em2 > 8330 [ACK] Seq=1 Ack=1 Win=900 Len=0

Frame 1: 60 bytes on wire (480 bits), 60 bytes captured (480 bits) on interface 0
Ethernet II, Src: Microchi_xx:xx:xx (MAC address), Dst: AsustekC_xx:xx:xx (MAC address)
Internet Protocol Version 4, Src: 192.168.0.216 (192.168.0.216), Dst: 192.168.0.201 (192.168.0.201)
Transmission Control Protocol, Src Port: oracle-em2 (1754), Dst Port: 8330 (8330), Seq: 1, Ack: 1, Len: 0

No.     Time           Source                Destination           Protocol Length Info
      2 0.001075000    192.168.0.216         192.168.0.201         TCP      60     ms-streaming > 8330 [FIN, ACK] Seq=1 Ack=1 Win=900 Len=0

Frame 2: 60 bytes on wire (480 bits), 60 bytes captured (480 bits) on interface 0
Ethernet II, Src: Microchi_xx:xx:xx (MAC address), Dst: AsustekC_xx:xx:xx (MAC address)
Internet Protocol Version 4, Src: 192.168.0.216 (192.168.0.216), Dst: 192.168.0.201 (192.168.0.201)
Transmission Control Protocol, Src Port: ms-streaming (1755), Dst Port: 8330 (8330), Seq: 1, Ack: 1, Len: 0

No.     Time           Source                Destination           Protocol Length Info
      3 0.001106000    192.168.0.201         192.168.0.216         TCP      54     8330 > ms-streaming [ACK] Seq=1 Ack=2 Win=65280 Len=0

Frame 3: 54 bytes on wire (432 bits), 54 bytes captured (432 bits) on interface 0
Ethernet II, Src: AsustekC_xx:xx:xx (MAC address), Dst: Microchi_xx:xx:xx (MAC address)
Internet Protocol Version 4, Src: 192.168.0.201 (192.168.0.201), Dst: 192.168.0.216 (192.168.0.216)
Transmission Control Protocol, Src Port: 8330 (8330), Dst Port: ms-streaming (1755), Seq: 1, Ack: 2, Len: 0

No.     Time           Source                Destination           Protocol Length Info
      4 0.001143000    192.168.0.201         192.168.0.216         TCP      54     8330 > ms-streaming [FIN, ACK] Seq=1 Ack=2 Win=65280 Len=0

Frame 4: 54 bytes on wire (432 bits), 54 bytes captured (432 bits) on interface 0
Ethernet II, Src: AsustekC_xx:xx:xx (MAC address), Dst: Microchi_xx:xx:xx (MAC address)
Internet Protocol Version 4, Src: 192.168.0.201 (192.168.0.201), Dst: 192.168.0.216 (192.168.0.216)
Transmission Control Protocol, Src Port: 8330 (8330), Dst Port: ms-streaming (1755), Seq: 1, Ack: 2, Len: 0

No.     Time           Source                Destination           Protocol Length Info
      5 0.007150000    192.168.0.216         192.168.0.201         TCP      60     ms-streaming > 8330 [ACK] Seq=2 Ack=2 Win=900 Len=0

Frame 5: 60 bytes on wire (480 bits), 60 bytes captured (480 bits) on interface 0
Ethernet II, Src: Microchi_xx:xx:xx (MAC address), Dst: AsustekC_xx:xx:xx (MAC address)
Internet Protocol Version 4, Src: 192.168.0.216 (192.168.0.216), Dst: 192.168.0.201 (192.168.0.201)
Transmission Control Protocol, Src Port: ms-streaming (1755), Dst Port: 8330 (8330), Seq: 2, Ack: 2, Len: 0

No.     Time           Source                Destination           Protocol Length Info
      6 0.008234000    192.168.0.216         192.168.0.201         TCP      60     capfast-lmd > 8330 [FIN, ACK] Seq=1 Ack=1 Win=900 Len=0

Frame 6: 60 bytes on wire (480 bits), 60 bytes captured (480 bits) on interface 0
Ethernet II, Src: Microchi_xx:xx:xx (MAC address), Dst: AsustekC_xx:xx:xx (MAC address)
Internet Protocol Version 4, Src: 192.168.0.216 (192.168.0.216), Dst: 192.168.0.201 (192.168.0.201)
Transmission Control Protocol, Src Port: capfast-lmd (1756), Dst Port: 8330 (8330), Seq: 1, Ack: 1, Len: 0

**Comment by luke-jr** [comment]
Basically all the relevant information is missing from those pastes :|

Can you upload the pcap files to dropbox or something?

**Comment by silverthornne** [comment]
How's google drive? I'd need to share it with you somehow. Does the dashjr email in your Github profile work? I can set up a share through Drive using that email to invite you.

**Comment by luke-jr** [comment]
Sounds like a plan. Remove everything from the + onward for my Google account.

**Comment by silverthornne** [comment]
Shared pcap's with an @gmail email that has all four characters before the + in your profile email.

**Comment by luke-jr** [comment]
well, that won't work because it's @dashjr

**Comment by luke-jr** [comment]
@silverthornne Can you please test http://luke.dashjr.org/tmp/code/webisect/webisect.php?dobuild=bfcube_workaround ASAP?

**Comment by silverthornne** [comment]
Ok, working great so far! Cube is no longer hopping between pools and it displays the number of accepted shares without issues. Performance on both 32 and 64-bit versions is also very good. As far as I'm concerned, it's a keeper! Of course, I'm only testing out the proxies and Icarus support since that's what I have running with it.

**Comment by luke-jr** [comment]
Can you close this?
